{
  "description": "Lifecycle of a company record from prospect to active to inactive.",
  "entity": "Company",
  "id": "company-lifecycle",
  "initialState": "Prospect",
  "label": {
    "en": "Company Lifecycle"
  },
  "name": "CompanyLifecycle",
  "states": [
    {
      "label": {
        "en": "Prospect"
      },
      "name": "Prospect"
    },
    {
      "label": {
        "en": "Active"
      },
      "name": "Active"
    },
    {
      "label": {
        "en": "Inactive"
      },
      "name": "Inactive",
      "terminal": true
    }
  ],
  "transitions": [
    {
      "actions": [
        {
          "action": "set-field",
          "field": "status",
          "value": "Active"
        },
        {
          "action": "send-notification",
          "template": "company-activated",
          "to": {
            "var": "email"
          }
        }
      ],
      "from": [
        "Prospect"
      ],
      "guard": {
        "==": [
          {
            "var": "creditLimit"
          },
          0
        ]
      },
      "label": {
        "en": "Activate"
      },
      "name": "activate",
      "to": "Active"
    },
    {
      "actions": [
        {
          "action": "set-field",
          "field": "status",
          "value": "Inactive"
        }
      ],
      "from": [
        "Active"
      ],
      "guard": {
        "==": [
          {
            "var": "balance"
          },
          0
        ]
      },
      "label": {
        "en": "Deactivate"
      },
      "name": "deactivate",
      "to": "Inactive"
    },
    {
      "actions": [
        {
          "action": "set-field",
          "field": "status",
          "value": "Active"
        }
      ],
      "from": [
        "Inactive"
      ],
      "guard": {
        "==": [
          {
            "var": "balance"
          },
          0
        ]
      },
      "label": {
        "en": "Reinstate"
      },
      "name": "reinstate",
      "to": "Active"
    }
  ]
}
